keyword,A.I. Artificial Intelligence photo booths rent,A.I. Artificial Intelligence photo booths rent,https://sites.google.com/view/ai-face-swap-photo-booth/home
keyword,A.I. Artificial Intelligence photo booth rentals Orange County,A.I. Artificial Intelligence photo booth rentals Orange County,https://drive.google.com/drive/folders/1pa82aGyInZSR8j94_YkHlX1pf6ERtErp?usp=sharing
keyword,Artificial Intelligence photobooth rental Orange County,Artificial Intelligence photobooth rental Orange County,https://docs.google.com/document/d/1yjjlEeb29-WVtervVRpXpawx-ov0aDqCb2JCWhlGfPE/edit?usp=sharing
keyword,renting a Artificial Intelligence photo booth in Orange County,renting a Artificial Intelligence photo booth in Orange County,https://docs.google.com/document/d/1yjjlEeb29-WVtervVRpXpawx-ov0aDqCb2JCWhlGfPE/pub
keyword,rent a Artificial Intelligence photobooth Orange County,rent a Artificial Intelligence photobooth Orange County,https://docs.google.com/document/d/1ZcrelIPi0Tf3WudvmBi75nx91D1PebkNxuNvrvUQ52c/edit?usp=sharing
keyword,A.I. photo booth rental package Orange County,A.I. photo booth rental package Orange County,https://docs.google.com/document/d/1ZcrelIPi0Tf3WudvmBi75nx91D1PebkNxuNvrvUQ52c/pub
keyword,A.I. photobooth for rent Orange County,A.I. photobooth for rent Orange County,https://docs.google.com/document/d/1ZcrelIPi0Tf3WudvmBi75nx91D1PebkNxuNvrvUQ52c/view
keyword,A.I. photo booths rent Orange County,A.I. photo booths rent Orange County,https://docs.google.com/document/d/1VisrynX3VDDoshZmu6tutAXv0hG7F99pLsAdh0Wu6fo/edit?usp=sharing
keyword,renting a A.I. photo booth in Orange County,renting a A.I. photo booth in Orange County,https://docs.google.com/document/d/1VisrynX3VDDoshZmu6tutAXv0hG7F99pLsAdh0Wu6fo/pub
keyword,corporate event A.I. Artificial Intelligence photo booth Orange County,corporate event A.I. Artificial Intelligence photo booth Orange County,https://docs.google.com/document/d/1VisrynX3VDDoshZmu6tutAXv0hG7F99pLsAdh0Wu6fo/view
keyword,A.I. Artificial Intelligence photo booth rental orange county,A.I. Artificial Intelligence photo booth rental orange county,https://docs.google.com/document/d/1Ht3eOZ8FcKWVfNYFvRdTP6oJjIvLCSqslgmub_lnBfU/edit?usp=sharing
keyword,wedding A.I. Artificial Intelligence photo booth rental in orange county,wedding A.I. Artificial Intelligence photo booth rental in orange county,https://docs.google.com/document/d/1Ht3eOZ8FcKWVfNYFvRdTP6oJjIvLCSqslgmub_lnBfU/pub
keyword,A.I. Artificial Intelligence photo booth rental in orange county,A.I. Artificial Intelligence photo booth rental in orange county,https://docs.google.com/document/d/1Ht3eOZ8FcKWVfNYFvRdTP6oJjIvLCSqslgmub_lnBfU/view
keyword,A.I. Artificial Intelligence photo booth for rent orange county,A.I. Artificial Intelligence photo booth for rent orange county,https://docs.google.com/document/d/1Q3kIAO9CZGjmb0CGwh0o_Y1bOiebKHfVU23HShsuKE0/edit?usp=sharing
keyword,A.I. Artificial Intelligence photo booth for rental orange county,A.I. Artificial Intelligence photo booth for rental orange county,https://docs.google.com/document/d/1Q3kIAO9CZGjmb0CGwh0o_Y1bOiebKHfVU23HShsuKE0/pub
keyword,A.I. Artificial Intelligence photo booth to rental orange county,A.I. Artificial Intelligence photo booth to rental orange county,https://docs.google.com/document/d/1Q3kIAO9CZGjmb0CGwh0o_Y1bOiebKHfVU23HShsuKE0/view
keyword,A.I. Artificial Intelligence photo booth to rent orange county,A.I. Artificial Intelligence photo booth to rent orange county,https://docs.google.com/document/d/1qJtjUY_-JuHwPk8fHaIfQfVcjb0grQ4Ak9W9fXzqYHM/edit?usp=sharing
keyword,A.I. Artificial Intelligence open air photo booth rental orange county,A.I. Artificial Intelligence open air photo booth rental orange county,https://docs.google.com/document/d/1qJtjUY_-JuHwPk8fHaIfQfVcjb0grQ4Ak9W9fXzqYHM/pub
keyword,A.I. Artificial Intelligence oc events photo booth,A.I. Artificial Intelligence oc events photo booth,https://docs.google.com/document/d/1qJtjUY_-JuHwPk8fHaIfQfVcjb0grQ4Ak9W9fXzqYHM/view
keyword,A.I. Artificial Intelligence oc photo booth,A.I. Artificial Intelligence oc photo booth,https://docs.google.com/document/d/11OCPMQKRPNgNQOSrGYB4mJLSOelA1TkFR3w1hIO5iF4/edit?usp=sharing
keyword,A.I. Artificial Intelligence photo booth rentals orange county,A.I. Artificial Intelligence photo booth rentals orange county,https://docs.google.com/document/d/11OCPMQKRPNgNQOSrGYB4mJLSOelA1TkFR3w1hIO5iF4/pub